{
  "schema_id": "mdplace.validation-report/v1",
  "package_series": "mdplace-spec/v1",
  "release_version": "1.0.0",
  "validator_version": "1.2.0",
  "normative_digest": "432a95eda3345317079d35f82247ddb49fb725a3d5ef3bced08e6a591413e1ec",
  "conformance_digest": "e5e13b1a5e4a2aeaa67dc8c836c1c54709882b48474d75e8e52220018d4d0a41",
  "verdict": "pass",
  "checks": [
    {
      "id": "package-manifest",
      "verdict": "pass",
      "codes": []
    },
    {
      "id": "artifact-bindings",
      "verdict": "pass",
      "codes": []
    },
    {
      "id": "requirements",
      "verdict": "pass",
      "codes": []
    },
    {
      "id": "package-lifecycle",
      "verdict": "pass",
      "codes": []
    },
    {
      "id": "evidence-lifecycle",
      "verdict": "pass",
      "codes": []
    },
    {
      "id": "semantic-kernel-lifecycle",
      "verdict": "pass",
      "codes": []
    },
    {
      "id": "contract-schemas",
      "verdict": "pass",
      "codes": []
    },
    {
      "id": "schema-instances",
      "verdict": "pass",
      "codes": []
    },
    {
      "id": "validator-evidence-contract",
      "verdict": "pass",
      "codes": []
    },
    {
      "id": "semantic-kernel-contract",
      "verdict": "pass",
      "codes": []
    },
    {
      "id": "control-plane-contract",
      "verdict": "pass",
      "codes": []
    },
    {
      "id": "traceability",
      "verdict": "pass",
      "codes": []
    },
    {
      "id": "conformance-manifest",
      "verdict": "pass",
      "codes": []
    }
  ],
  "fixture_results": [
    {
      "id": "FIX-PKG-POS-001",
      "verdict": "pass",
      "codes": []
    },
    {
      "id": "FIX-PKG-POS-002",
      "verdict": "pass",
      "codes": []
    },
    {
      "id": "FIX-PKG-POS-003",
      "verdict": "pass",
      "codes": []
    },
    {
      "id": "FIX-PKG-POS-004",
      "verdict": "pass",
      "codes": []
    },
    {
      "id": "FIX-PKG-POS-005",
      "verdict": "pass",
      "codes": []
    },
    {
      "id": "FIX-PKG-POS-006",
      "verdict": "pass",
      "codes": []
    },
    {
      "id": "FIX-PKG-BND-001",
      "verdict": "pass",
      "codes": []
    },
    {
      "id": "FIX-PKG-BND-002",
      "verdict": "pass",
      "codes": []
    },
    {
      "id": "FIX-PKG-BND-003",
      "verdict": "pass",
      "codes": []
    },
    {
      "id": "FIX-PKG-NEG-001",
      "verdict": "pass",
      "codes": []
    },
    {
      "id": "FIX-PKG-NEG-002",
      "verdict": "pass",
      "codes": []
    },
    {
      "id": "FIX-PKG-NEG-003",
      "verdict": "pass",
      "codes": []
    },
    {
      "id": "FIX-PKG-NEG-004",
      "verdict": "pass",
      "codes": []
    },
    {
      "id": "FIX-PKG-NEG-005",
      "verdict": "pass",
      "codes": []
    },
    {
      "id": "FIX-PKG-NEG-006",
      "verdict": "pass",
      "codes": []
    },
    {
      "id": "FIX-PKG-NEG-007",
      "verdict": "pass",
      "codes": []
    },
    {
      "id": "FIX-PKG-NEG-008",
      "verdict": "pass",
      "codes": []
    },
    {
      "id": "FIX-PKG-NEG-009",
      "verdict": "pass",
      "codes": []
    },
    {
      "id": "FIX-PKG-NEG-010",
      "verdict": "pass",
      "codes": []
    },
    {
      "id": "FIX-PKG-NEG-011",
      "verdict": "pass",
      "codes": []
    },
    {
      "id": "FIX-PKG-NEG-012",
      "verdict": "pass",
      "codes": []
    },
    {
      "id": "FIX-PKG-NEG-013",
      "verdict": "pass",
      "codes": []
    },
    {
      "id": "FIX-PKG-NEG-015",
      "verdict": "pass",
      "codes": []
    },
    {
      "id": "FIX-PKG-STATE-001",
      "verdict": "pass",
      "codes": []
    },
    {
      "id": "FIX-PKG-AUTH-001",
      "verdict": "pass",
      "codes": []
    },
    {
      "id": "FIX-PKG-ILLEGAL-001",
      "verdict": "pass",
      "codes": []
    },
    {
      "id": "FIX-PKG-REC-001",
      "verdict": "pass",
      "codes": []
    },
    {
      "id": "FIX-PKG-ILLEGAL-002",
      "verdict": "pass",
      "codes": []
    },
    {
      "id": "FIX-PKG-ILLEGAL-003",
      "verdict": "pass",
      "codes": []
    },
    {
      "id": "FIX-PKG-ILLEGAL-004",
      "verdict": "pass",
      "codes": []
    },
    {
      "id": "FIX-PKG-ILLEGAL-005",
      "verdict": "pass",
      "codes": []
    },
    {
      "id": "FIX-PKG-ILLEGAL-006",
      "verdict": "pass",
      "codes": []
    },
    {
      "id": "FIX-PKG-ILLEGAL-007",
      "verdict": "pass",
      "codes": []
    },
    {
      "id": "FIX-PKG-ILLEGAL-008",
      "verdict": "pass",
      "codes": []
    },
    {
      "id": "FIX-PKG-ILLEGAL-009",
      "verdict": "pass",
      "codes": []
    },
    {
      "id": "FIX-PKG-ILLEGAL-010",
      "verdict": "pass",
      "codes": []
    },
    {
      "id": "FIX-PKG-ILLEGAL-011",
      "verdict": "pass",
      "codes": []
    },
    {
      "id": "FIX-PKG-ILLEGAL-012",
      "verdict": "pass",
      "codes": []
    },
    {
      "id": "FIX-VAL-POS-001",
      "verdict": "pass",
      "codes": []
    },
    {
      "id": "FIX-VAL-NEG-001",
      "verdict": "pass",
      "codes": []
    },
    {
      "id": "FIX-VAL-POS-002",
      "verdict": "pass",
      "codes": []
    },
    {
      "id": "FIX-VAL-NEG-002",
      "verdict": "pass",
      "codes": []
    },
    {
      "id": "FIX-VAL-STATE-001",
      "verdict": "pass",
      "codes": []
    },
    {
      "id": "FIX-VAL-AUTH-001",
      "verdict": "pass",
      "codes": []
    },
    {
      "id": "FIX-VAL-REC-001",
      "verdict": "pass",
      "codes": []
    },
    {
      "id": "FIX-VAL-ILLEGAL-001",
      "verdict": "pass",
      "codes": []
    },
    {
      "id": "FIX-VAL-ILLEGAL-002",
      "verdict": "pass",
      "codes": []
    },
    {
      "id": "FIX-VAL-ILLEGAL-003",
      "verdict": "pass",
      "codes": []
    },
    {
      "id": "FIX-VAL-ILLEGAL-004",
      "verdict": "pass",
      "codes": []
    },
    {
      "id": "FIX-VAL-STATE-002",
      "verdict": "pass",
      "codes": []
    },
    {
      "id": "FIX-VAL-NEG-003",
      "verdict": "pass",
      "codes": []
    },
    {
      "id": "FIX-VAL-POS-003",
      "verdict": "pass",
      "codes": []
    },
    {
      "id": "FIX-VAL-REC-002",
      "verdict": "pass",
      "codes": []
    },
    {
      "id": "FIX-VAL-REC-003",
      "verdict": "pass",
      "codes": []
    },
    {
      "id": "FIX-VAL-ILLEGAL-005",
      "verdict": "pass",
      "codes": []
    },
    {
      "id": "FIX-VAL-NEG-004",
      "verdict": "pass",
      "codes": []
    },
    {
      "id": "FIX-VAL-NEG-005",
      "verdict": "pass",
      "codes": []
    },
    {
      "id": "FIX-VAL-NEG-006",
      "verdict": "pass",
      "codes": []
    },
    {
      "id": "FIX-SK-POS-001",
      "verdict": "pass",
      "codes": []
    },
    {
      "id": "FIX-SK-POS-002",
      "verdict": "pass",
      "codes": []
    },
    {
      "id": "FIX-SK-NEG-010",
      "verdict": "pass",
      "codes": []
    },
    {
      "id": "FIX-SK-BND-001",
      "verdict": "pass",
      "codes": []
    },
    {
      "id": "FIX-SK-STATE-001",
      "verdict": "pass",
      "codes": []
    },
    {
      "id": "FIX-SK-NEG-001",
      "verdict": "pass",
      "codes": []
    },
    {
      "id": "FIX-SK-POS-004",
      "verdict": "pass",
      "codes": []
    },
    {
      "id": "FIX-SK-NEG-002",
      "verdict": "pass",
      "codes": []
    },
    {
      "id": "FIX-SK-NEG-003",
      "verdict": "pass",
      "codes": []
    },
    {
      "id": "FIX-SK-NEG-004",
      "verdict": "pass",
      "codes": []
    },
    {
      "id": "FIX-SK-NEG-005",
      "verdict": "pass",
      "codes": []
    },
    {
      "id": "FIX-SK-NEG-006",
      "verdict": "pass",
      "codes": []
    },
    {
      "id": "FIX-SK-AUTH-001",
      "verdict": "pass",
      "codes": []
    },
    {
      "id": "FIX-SK-AUTH-002",
      "verdict": "pass",
      "codes": []
    },
    {
      "id": "FIX-SK-AUTH-003",
      "verdict": "pass",
      "codes": []
    },
    {
      "id": "FIX-SK-AUTH-004",
      "verdict": "pass",
      "codes": []
    },
    {
      "id": "FIX-SK-AUTH-005",
      "verdict": "pass",
      "codes": []
    },
    {
      "id": "FIX-SK-AUTH-006",
      "verdict": "pass",
      "codes": []
    },
    {
      "id": "FIX-SK-POS-005",
      "verdict": "pass",
      "codes": []
    },
    {
      "id": "FIX-SK-POS-006",
      "verdict": "pass",
      "codes": []
    },
    {
      "id": "FIX-SK-STATE-002",
      "verdict": "pass",
      "codes": []
    },
    {
      "id": "FIX-SK-POS-007",
      "verdict": "pass",
      "codes": []
    },
    {
      "id": "FIX-SK-NEG-008",
      "verdict": "pass",
      "codes": []
    },
    {
      "id": "FIX-SK-NEG-009",
      "verdict": "pass",
      "codes": []
    },
    {
      "id": "FIX-SK-POS-010",
      "verdict": "pass",
      "codes": []
    },
    {
      "id": "FIX-SK-NEG-007",
      "verdict": "pass",
      "codes": []
    },
    {
      "id": "FIX-SK-ILLEGAL-001",
      "verdict": "pass",
      "codes": []
    },
    {
      "id": "FIX-SK-REC-001",
      "verdict": "pass",
      "codes": []
    },
    {
      "id": "FIX-SK-REC-002",
      "verdict": "pass",
      "codes": []
    },
    {
      "id": "FIX-SK-ILLEGAL-002",
      "verdict": "pass",
      "codes": []
    },
    {
      "id": "FIX-CP-REC-001",
      "verdict": "pass",
      "codes": []
    },
    {
      "id": "FIX-CP-POS-001",
      "verdict": "pass",
      "codes": []
    },
    {
      "id": "FIX-CP-REC-002",
      "verdict": "pass",
      "codes": []
    },
    {
      "id": "FIX-CP-POS-002",
      "verdict": "pass",
      "codes": []
    },
    {
      "id": "FIX-CP-BND-001",
      "verdict": "pass",
      "codes": []
    },
    {
      "id": "FIX-CP-ILLEGAL-001",
      "verdict": "pass",
      "codes": []
    },
    {
      "id": "FIX-CP-POS-003",
      "verdict": "pass",
      "codes": []
    },
    {
      "id": "FIX-CP-POS-004",
      "verdict": "pass",
      "codes": []
    },
    {